{"schema_version":"agmind.temporary-egress-deny-intent.v1","intent_id":"int_875f0f15c0ddb3aed2ad402b38423b6b","verb":"temporary_egress_deny","host_id":"123e4567-e89b-42d3-a456-426614174000","docker_container_id":"aaaaaaaaaaaaaaaaaaaaaaaaaaaaaaaaaaaaaaaaaaaaaaaaaaaaaaaaaaaaaaaa","docker_started_at":"2026-07-27T12:00:00Z","image_id":"sha256:bbbbbbbbbbbbbbbbbbbbbbbbbbbbbbbbbbbbbbbbbbbbbbbbbbbbbbbbbbbbbbbb","repo_digests":[],"immutable_spec_sha256":"cccccccccccccccccccccccccccccccccccccccccccccccccccccccccccccccc","inventory_generation":2,"inventory_revision":1,"destination_ipv4":"1.1.1.1","ttl_seconds":120,"evidence_ids":["evt_5ca264c47eb4ca4cf63114dba860fb95179167fcd0674d5d976a15c9e7473e98"],"detector_bundle_sha256":"dddddddddddddddddddddddddddddddddddddddddddddddddddddddddddddddd","policy_bundle_version":"pcc-v1","policy_bundle_sha256":"eeeeeeeeeeeeeeeeeeeeeeeeeeeeeeeeeeeeeeeeeeeeeeeeeeeeeeeeeeeeeeee","coverage_snapshot_sha256":"ffffffffffffffffffffffffffffffffffffffffffffffffffffffffffffffff","created_at":"2026-07-27T12:00:00Z"}
